{
  "schema_version": "x-relay.eval-dataset-result.v1",
  "eval_run_id": "22222222-3333-4444-5555-666666666666",
  "dataset_digest": "5555555555555555555555555555555555555555555555555555555555555555",
  "case_count": 100,
  "score": 0.95,
  "threshold": 0.9,
  "failed_case_ids": ["case-014", "case-072"],
  "completed_at": "2026-05-15T12:00:00Z"
}
